[
  {
    "prefabId": 0,
    "resourceName": "{0000000000000001}Prefabs/Vegetation/Trees/Tree_Pinus_M.et",
    "kind": "tree",
    "class": "conifer",
    "label": "Pine tree (medium)",
    "ai": {
      "summary": "Medium conifer pine; static vegetation; soft cover to ~4 m standing.",
      "taxonomyPath": "vegetation/tree/conifer",
      "classificationSource": "rules-v1/prefab-name",
      "confidence": 0.92,
      "needsReview": false
    },
    "spatial": {
      "model": "obb",
      "pivot": "base",
      "halfExtentsM": {
        "x": 1.2,
        "y": 1.2,
        "z": 6
      },
      "heightM": 12
    },
    "gameplay": {
      "cover": {
        "type": "soft",
        "standing": true,
        "prone": true,
        "crouch": true,
        "heightM": 4
      },
      "movement": {
        "blocksInfantry": false,
        "blocksVehicle": false
      },
      "lineOfSight": "partial",
      "destructible": true,
      "climbable": false,
      "enterable": false,
      "ladder": false,
      "door": false,
      "bridge": false,
      "runway": false
    },
    "render": {
      "iconKey": "tree-conifer",
      "lodMinZoom": 1,
      "baseSizePx": 18,
      "anchor": [
        0.5,
        1.0
      ],
      "tintable": true,
      "defaultColor": "#2d5a27"
    }
  },
  {
    "prefabId": 1,
    "resourceName": "{0000000000000002}Prefabs/Vegetation/Trees/Tree_Quercus_L.et",
    "kind": "tree",
    "class": "deciduous",
    "label": "Oak tree (large)",
    "ai": {
      "summary": "Large deciduous oak; static vegetation; soft cover.",
      "taxonomyPath": "vegetation/tree/deciduous",
      "classificationSource": "rules-v1/prefab-name",
      "confidence": 0.9,
      "needsReview": false
    },
    "spatial": {
      "model": "obb",
      "pivot": "base",
      "halfExtentsM": {
        "x": 1.5,
        "y": 1.5,
        "z": 5
      },
      "heightM": 10
    },
    "gameplay": {
      "cover": {
        "type": "soft",
        "standing": true,
        "prone": true,
        "crouch": true,
        "heightM": 3.5
      },
      "movement": {
        "blocksInfantry": false,
        "blocksVehicle": false
      },
      "lineOfSight": "partial",
      "destructible": true,
      "climbable": false,
      "enterable": false,
      "ladder": false,
      "door": false,
      "bridge": false,
      "runway": false
    },
    "render": {
      "iconKey": "tree-deciduous",
      "lodMinZoom": 1,
      "baseSizePx": 16,
      "anchor": [
        0.5,
        1.0
      ],
      "tintable": true,
      "defaultColor": "#4a7a32"
    }
  },
  {
    "prefabId": 2,
    "resourceName": "{0000000000000003}Prefabs/Vegetation/Trees/Tree_Palm_M.et",
    "kind": "tree",
    "class": "palm",
    "label": "Palm tree",
    "ai": {
      "summary": "Coastal palm; static vegetation; light soft cover.",
      "taxonomyPath": "vegetation/tree/palm",
      "classificationSource": "rules-v1/prefab-name",
      "confidence": 0.85,
      "needsReview": false
    },
    "spatial": {
      "model": "obb",
      "pivot": "base",
      "halfExtentsM": {
        "x": 1.0,
        "y": 1.0,
        "z": 5
      },
      "heightM": 9
    },
    "gameplay": {
      "cover": {
        "type": "soft",
        "standing": false,
        "prone": true,
        "crouch": true,
        "heightM": 2
      },
      "movement": {
        "blocksInfantry": false,
        "blocksVehicle": false
      },
      "lineOfSight": "partial",
      "destructible": true,
      "climbable": false,
      "enterable": false,
      "ladder": false,
      "door": false,
      "bridge": false,
      "runway": false
    },
    "render": {
      "iconKey": "tree-palm",
      "lodMinZoom": 1,
      "baseSizePx": 16,
      "anchor": [
        0.5,
        1.0
      ],
      "tintable": true,
      "defaultColor": "#5a8a3a"
    }
  },
  {
    "prefabId": 3,
    "resourceName": "{0000000000000004}Prefabs/Vegetation/Bushes/Bush_Common_M.et",
    "kind": "vegetation",
    "class": "bush",
    "label": "Bush (medium)",
    "ai": {
      "summary": "Low shrub; concealment only; no ballistic protection.",
      "taxonomyPath": "vegetation/bush",
      "classificationSource": "rules-v1/prefab-name",
      "confidence": 0.8,
      "needsReview": false
    },
    "spatial": {
      "model": "obb",
      "pivot": "base",
      "halfExtentsM": {
        "x": 0.8,
        "y": 0.8,
        "z": 0.6
      },
      "heightM": 1.2
    },
    "gameplay": {
      "cover": {
        "type": "soft",
        "standing": false,
        "prone": true,
        "crouch": true,
        "heightM": 1
      },
      "movement": {
        "blocksInfantry": false,
        "blocksVehicle": false
      },
      "lineOfSight": "partial",
      "destructible": true,
      "climbable": false,
      "enterable": false,
      "ladder": false,
      "door": false,
      "bridge": false,
      "runway": false
    },
    "render": {
      "iconKey": "vegetation-bush",
      "lodMinZoom": 3,
      "baseSizePx": 12,
      "anchor": [
        0.5,
        1.0
      ],
      "tintable": true,
      "defaultColor": "#3d6a28"
    }
  },
  {
    "prefabId": 4,
    "resourceName": "{0000000000000005}Prefabs/Rocks/Rock_Granite_Boulder_L.et",
    "kind": "rock",
    "class": "boulder",
    "label": "Granite boulder (large)",
    "ai": {
      "summary": "Large standalone boulder; hard cover; blocks movement and LOS.",
      "taxonomyPath": "terrain/rock/boulder",
      "classificationSource": "rules-v1/prefab-name",
      "confidence": 0.88,
      "needsReview": false
    },
    "spatial": {
      "model": "obb",
      "pivot": "center",
      "halfExtentsM": {
        "x": 2.5,
        "y": 2.0,
        "z": 1.5
      },
      "heightM": 3
    },
    "gameplay": {
      "cover": {
        "type": "hard",
        "standing": true,
        "prone": true,
        "crouch": true,
        "heightM": 1.5
      },
      "movement": {
        "blocksInfantry": true,
        "blocksVehicle": true
      },
      "lineOfSight": "full",
      "destructible": false,
      "climbable": false,
      "enterable": false,
      "ladder": false,
      "door": false,
      "bridge": false,
      "runway": false
    },
    "render": {
      "iconKey": "rock-boulder",
      "lodMinZoom": 3,
      "baseSizePx": 14,
      "anchor": [
        0.5,
        0.5
      ]
    }
  },
  {
    "prefabId": 5,
    "resourceName": "{0000000000000006}Prefabs/Props/Fences/Fence_Wire_4m.et",
    "kind": "prop",
    "class": "fence",
    "label": "Wire fence (4 m)",
    "ai": {
      "summary": "Wire perimeter fence; no cover; minor movement obstacle.",
      "taxonomyPath": "misc/prop/fence",
      "classificationSource": "rules-v1/prefab-name",
      "confidence": 0.82,
      "needsReview": false
    },
    "spatial": {
      "model": "obb",
      "pivot": "base",
      "halfExtentsM": {
        "x": 2.0,
        "y": 0.1,
        "z": 0.9
      },
      "heightM": 1.8
    },
    "gameplay": {
      "cover": {
        "type": "none",
        "standing": false,
        "prone": false,
        "crouch": false,
        "heightM": 0
      },
      "movement": {
        "blocksInfantry": true,
        "blocksVehicle": true
      },
      "lineOfSight": "none",
      "destructible": true,
      "climbable": true,
      "enterable": false,
      "ladder": false,
      "door": false,
      "bridge": false,
      "runway": false
    },
    "render": {
      "iconKey": "prop-fence",
      "lodMinZoom": 3,
      "baseSizePx": 12,
      "anchor": [
        0.5,
        1.0
      ]
    }
  },
  {
    "prefabId": 6,
    "resourceName": "{0000000000000007}Prefabs/Structures/Utility/PowerPole_Wood.et",
    "kind": "utility",
    "class": "powerline",
    "label": "Power pole (wood)",
    "ai": {
      "summary": "Wooden power pole; tall thin infrastructure; partial LOS break.",
      "taxonomyPath": "infrastructure/utility/powerline",
      "classificationSource": "rules-v1/prefab-name",
      "confidence": 0.8,
      "needsReview": false
    },
    "spatial": {
      "model": "obb",
      "pivot": "base",
      "halfExtentsM": {
        "x": 0.3,
        "y": 0.3,
        "z": 5
      },
      "heightM": 10
    },
    "gameplay": {
      "cover": {
        "type": "soft",
        "standing": true,
        "prone": false,
        "crouch": false,
        "heightM": 0.3
      },
      "movement": {
        "blocksInfantry": false,
        "blocksVehicle": false
      },
      "lineOfSight": "partial",
      "destructible": true,
      "climbable": false,
      "enterable": false,
      "ladder": false,
      "door": false,
      "bridge": false,
      "runway": false
    },
    "render": {
      "iconKey": "utility-powerline",
      "lodMinZoom": 3,
      "baseSizePx": 12,
      "anchor": [
        0.5,
        1.0
      ]
    }
  },
  {
    "prefabId": 7,
    "resourceName": "{0000000000000008}Prefabs/Structures/Water/Pier_Wood_8m.et",
    "kind": "water",
    "class": "pier",
    "label": "Wooden pier (8 m)",
    "ai": {
      "summary": "Wooden pier over water; walkable; no cover.",
      "taxonomyPath": "infrastructure/water/pier",
      "classificationSource": "rules-v1/prefab-name",
      "confidence": 0.78,
      "needsReview": false
    },
    "spatial": {
      "model": "obb",
      "pivot": "base",
      "halfExtentsM": {
        "x": 4,
        "y": 1,
        "z": 0.3
      },
      "heightM": 0.6
    },
    "gameplay": {
      "cover": {
        "type": "none",
        "standing": false,
        "prone": false,
        "crouch": false,
        "heightM": 0
      },
      "movement": {
        "blocksInfantry": false,
        "blocksVehicle": false
      },
      "lineOfSight": "none",
      "destructible": true,
      "climbable": false,
      "enterable": false,
      "ladder": false,
      "door": false,
      "bridge": true,
      "runway": false
    }
  },
  {
    "prefabId": 8,